{
  "$schema": "http://json-schema.org/draft-07/schema#",
  "$id": "domain-semantics.schema.json",
  "title": "Domain Semantics Sidecar",
  "description": "Hand-maintained sidecar consumed by path-analyser. Cross-section invariants (e.g. artifactKindStateDeclared, semanticTypeWitnessTargetResolves) are enforced at load time by path-analyser/src/domainSemanticsValidator.ts and intentionally NOT re-encoded here — Draft-07 cannot express them.",
  "type": "object",
  "additionalProperties": false,
  "required": ["identifiers","runtimeStates","operationRequirements","version"],
  "properties": {
    "$schema": {"type": "string"},
    "version": {"type": "integer", "minimum": 1},
    "identifiers": {
      "type": "object",
      "additionalProperties": {
        "type": "object",
        "additionalProperties": false,
        "required": ["kind","boundBy"],
        "properties": {
          "kind": {"const": "identifier"},
          "validityState": {"type": "string"},
          "boundBy": {"type": "array", "items": {"type": "string"}},
          "fieldPaths": {"type": "array", "items": {"type": "string"}},
          "derivedVia": {"type": "string"}
        }
      }
    },
    "capabilities": {
      "type": "object",
      "additionalProperties": {
        "type": "object",
        "additionalProperties": false,
        "required": ["kind","parameter","producedBy"],
        "properties": {
          "kind": {"const": "capability"},
          "parameter": {"type": "string"},
          "producedBy": {"type": "array", "items": {"type": "string"}},
          "dependsOn": {"type": "array", "items": {"type": "string"}}
        }
      }
    },
    "runtimeStates": {
      "type": "object",
      "additionalProperties": {
        "type": "object",
        "additionalProperties": false,
        "required": ["kind","producedBy"],
        "properties": {
          "kind": {"const": "state"},
          "parameter": {"type": "string"},
          "parameters": {"type": "array", "items": {"type": "string"}},
          "producedBy": {"type": "array", "items": {"type": "string"}},
          "requires": {"type": "array", "items": {"type": "string"}},
          "$comment": {"type": "string"},
          "eventual": {
            "type": "boolean",
            "description": "When true, the state lags behind its producer's response. The planner inserts an awaitEventually(witness) wait between producer and consumer steps (#159 PR B). Requires `witness`."
          },
          "witness": {
            "type": "object",
            "additionalProperties": false,
            "required": ["operationId", "predicate"],
            "description": "Witness used by the awaitEventually wait when `eventual === true`. Polls the named operation until the structured predicate holds.",
            "properties": {
              "operationId": {"type": "string", "minLength": 1},
              "predicate": {
                "type": "object",
                "additionalProperties": false,
                "required": ["path", "equals"],
                "properties": {
                  "path": {
                    "type": "string",
                    "pattern": "^[A-Za-z_$][A-Za-z0-9_$]*$",
                    "description": "Single top-level field on the response body (PR B: no nested paths)."
                  },
                  "equals": {
                    "oneOf": [
                      {"type": "string"},
                      {"type": "number"},
                      {"type": "boolean"}
                    ]
                  }
                }
              },
              "waitUpToMs": {"type": "integer", "minimum": 1},
              "pollIntervalMs": {"type": "integer", "minimum": 1}
            }
          }
        }
      }
    },
    "semanticTypes": {
      "description": "Declarations of semantic identifier types (e.g. ProcessDefinitionKey). Each entry's `witnesses` names the runtimeStates/capabilities entry whose presence proves the semantic value exists. Cross-section resolution of `witnesses` is enforced at load time by domainSemanticsValidator.ts.",
      "type": "object",
      "additionalProperties": {
        "type": "object",
        "additionalProperties": false,
        "properties": {
          "witnesses": {"type": "string", "minLength": 1}
        }
      }
    },
    "artifactKinds": {
      "description": "Declarations of deployable artifact kinds (e.g. bpmnProcess). `producesStates`, `producibleStates`, and `producesSemantics` cross-references are enforced at load time by domainSemanticsValidator.ts.",
      "type": "object",
      "additionalProperties": {
        "type": "object",
        "additionalProperties": false,
        "properties": {
          "producesStates": {"type": "array", "items": {"type": "string"}},
          "producibleStates": {"type": "array", "items": {"type": "string"}},
          "producesSemantics": {"type": "array", "items": {"type": "string"}},
          "identifierType": {"type": "string"},
          "deploymentSlices": {"type": "array", "items": {"type": "string"}}
        }
      }
    },
    "artifactFileKinds": {
      "description": "Map of single file extensions as returned by `path.extname()` (including leading dot, e.g. `.bpmn` or `.xml`) to the list of artifactKinds that file may contain. Multi-dot suffixes such as `.bpmn20.xml` are intentionally NOT allowed: runtime consumers in path-analyser/src/index.ts resolve only the final extension via `path.extname(...)`, so multi-dot keys never match at runtime and would be silently dead config.",
      "type": "object",
      "propertyNames": {"pattern": "^\\.[A-Za-z0-9_]+$"},
      "additionalProperties": {
        "type": "array",
        "items": {"type": "string"},
        "minItems": 1
      }
    },
    "semanticTypeToArtifactKind": {
      "description": "Map of semantic type name (e.g. ProcessDefinitionKey) to the artifactKind that produces it. Used by the planner to resolve which fixture kind satisfies a semantic prerequisite.",
      "type": "object",
      "additionalProperties": {"type": "string"}
    },
    "operationArtifactRules": {
      "description": "Per-operation rules describing how request fields map to deployable artifacts. Consumed by the planner to decompose composite deployment operations into per-artifact slices. Field shape mirrors `ArtifactRule` and `OperationArtifactRuleSpec` in path-analyser/src/types.ts — keep them in sync.",
      "type": "object",
      "additionalProperties": {
        "type": "object",
        "additionalProperties": false,
        "properties": {
          "composable": {"type": "boolean"},
          "rules": {
            "type": "array",
            "items": {
              "type": "object",
              "additionalProperties": false,
              "required": ["artifactKind"],
              "properties": {
                "id": {"type": "string", "minLength": 1},
                "artifactKind": {"type": "string", "minLength": 1},
                "priority": {"type": "integer"},
                "producesSemantics": {
                  "type": "array",
                  "items": {"type": "string"}
                },
                "producesStates": {
                  "type": "array",
                  "items": {"type": "string"}
                }
              }
            }
          }
        }
      }
    },
    "operationRequirements": {
      "type": "object",
      "additionalProperties": {
        "type": "object",
        "additionalProperties": false,
        "properties": {
          "requires": {"type": "array", "items": {"type": "string"}},
          "disjunctions": {"type": "array", "items": {"type": "array", "items": {"type": "string"}}},
          "implicitAdds": {"type": "array", "items": {"type": "string"}},
          "produces": {"type": "array", "items": {"type": "string"}},
          "valueBindings": {
            "type": "object",
            "description": "Field-name -> source binding. Each value is one of two grammars: `semantic:<TypeName>` (resolves a semanticTypes entry) or `<StateName>.<parameterName>` (resolves a runtimeStates/capabilities parameter). Cross-section resolution is enforced at load time by domainSemanticsValidator.ts.",
            "additionalProperties": {
              "type": "string",
              "oneOf": [
                {"pattern": "^semantic:[A-Za-z_][A-Za-z0-9_]*$"},
                {"pattern": "^[A-Za-z_][A-Za-z0-9_]*\\.[A-Za-z_][A-Za-z0-9_]*$"}
              ]
            }
          }
        }
      }
    },
    "globalContextSeeds": {
      "description": "Bindings that every emitted scenario must seed into ctx before its request plan runs (e.g. the default-tenant identifier under single-tenant mode). Drives the emitter's universal-seed logic so the codegen layer carries no hard-coded bind names or sentinel values.",
      "type": "array",
      "items": {
        "type": "object",
        "required": ["binding", "fieldName", "seedRule"],
        "additionalProperties": false,
        "properties": {
          "binding": {
            "type": "string",
            "pattern": "^[A-Za-z_$][A-Za-z0-9_$]*$",
            "description": "ctx[<binding>] key the seed populates. Must be a safe JS identifier (matches the runtime check in domainSemanticsValidator.ts) so the emitter can interpolate it into emitted TS without escaping."
          },
          "fieldName": {
            "type": "string",
            "pattern": "^[A-Za-z_$][A-Za-z0-9_$]*$",
            "description": "Request-body / multipart field name this binding maps to. Must be a safe JS identifier — used to derive the emitter's `__<fieldName>IsDefault` sentinel local."
          },
          "seedRule": {
            "type": "string",
            "pattern": "^[A-Za-z_$][A-Za-z0-9_$]*$",
            "description": "Key passed to seedBinding() at runtime; must match a rule in seed-rules.json. Restricted to a safe identifier so it can be interpolated into the emitted seedBinding('<seedRule>') call without escaping."
          },
          "defaultSentinel": {
            "type": "string",
            "pattern": "^[^'\\\\\r\n\t\u0000-\u001f\u2028\u2029]*$",
            "description": "Magic value that, when present in ctx[<binding>], triggers field-stripping in multipart bodies. Rejects single quotes, backslashes, line terminators, and control characters (including U+2028/U+2029) so it stays safe inside the single-quoted TS string literal the emitter produces."
          },
          "stripFromMultipartWhenDefault": {"type": "boolean", "description": "If true, the emitter inserts a multipart-loop branch that drops the field when ctx[<binding>] equals the defaultSentinel."},
          "rationale": {"type": "string"}
        },
        "allOf": [
          {
            "if": {
              "properties": {"stripFromMultipartWhenDefault": {"const": true}},
              "required": ["stripFromMultipartWhenDefault"]
            },
            "then": {"required": ["defaultSentinel"]}
          }
        ]
      }
    }
  }
}
