{
  "$schema": "./domain-semantics.schema.json#",
  "identifiers": {
    "ProcessDefinitionId": {
      "kind": "identifier",
      "validityState": "ProcessDefinitionDeployed",
      "boundBy": ["createDeployment"],
      "fieldPaths": ["deployments[].processDefinition.processDefinitionId"]
    },
    "JobTypeValue": {
      "kind": "identifier",
      "derivedVia": "ModelHasServiceTaskType",
      "boundBy": ["createDeployment"]
    }
  },
  "capabilities": {
    "ModelHasServiceTaskType": {
      "kind": "capability",
      "parameter": "jobType",
      "producedBy": ["createDeployment"],
      "dependsOn": ["ProcessDefinitionDeployed"]
    }
  },
  "runtimeStates": {
    "ProcessDefinitionDeployed": {
      "kind": "state",
      "parameter": "processDefinitionId",
      "producedBy": ["createDeployment"]
    },
    "ProcessInstanceExists": {
      "kind": "state",
      "parameter": "processDefinitionId",
      "producedBy": ["createProcessInstance"],
      "requires": ["ProcessDefinitionDeployed"]
    },
    "JobAvailableForActivation": {
      "kind": "state",
      "parameters": ["jobType", "processDefinitionId"],
      "producedBy": ["activateJobs"],
      "requires": ["ProcessInstanceExists", "ModelHasServiceTaskType"]
    },
    "FormDeployed": {
      "kind": "state",
      "parameter": "formKey",
      "producedBy": ["createDeployment"]
    },
    "DecisionDefinitionDeployed": {
      "kind": "state",
      "parameter": "decisionDefinitionId",
      "producedBy": ["createDeployment"]
    },
    "DecisionRequirementsDeployed": {
      "kind": "state",
      "parameter": "decisionRequirementsId",
      "producedBy": ["createDeployment"]
    }
  },
  "operationRequirements": {
    "createProcessInstance": {
      "requires": ["ProcessDefinitionDeployed"],
      "implicitAdds": ["ProcessInstanceExists"],
      "valueBindings": {
        "request.processDefinitionId": "ProcessDefinitionDeployed.processDefinitionId",
        "request.processDefinitionKey": "semantic:ProcessDefinitionKey",
        "response.processInstanceKey": "semantic:ProcessInstanceKey"
      }
    },
    "activateJobs": {
      "requires": ["ProcessInstanceExists", "ModelHasServiceTaskType"],
      "valueBindings": {
        "request.jobType": "ModelHasServiceTaskType.jobType"
      },
      "produces": ["JobAvailableForActivation"]
    },
    "searchJobs": {
      "requires": ["ProcessInstanceExists", "ModelHasServiceTaskType"]
    },
    "getUserTask": {
      "requires": ["ProcessInstanceExists"]
    },
    "searchProcessInstances": {
      "requires": ["ProcessInstanceExists"]
    },
    "createDeployment": {
      "valueBindings": {
        "response.deployments[].processDefinition.processDefinitionId": "ProcessDefinitionDeployed.processDefinitionId",
        "response.deployments[].processDefinition.processDefinitionKey": "semantic:ProcessDefinitionKey",
        "response.deployments[].form.formKey": "FormDeployed.formKey"
      }
    },
    "searchProcessDefinitions": {
      "requires": ["ProcessDefinitionDeployed"]
    }
  },
  "artifactKinds": {
    "bpmnProcess": {
      "producesStates": ["ProcessDefinitionDeployed", "ModelHasServiceTaskType"],
      "producesSemantics": ["ProcessDefinitionKey"],
      "identifierType": "ProcessDefinitionId",
      "deploymentSlices": ["processDefinition"]
    },
    "dmnDecision": {
      "producesStates": ["DecisionDefinitionDeployed"],
      "producesSemantics": ["DecisionDefinitionKey"],
      "identifierType": "DecisionDefinitionId",
      "deploymentSlices": ["decisionDefinition"]
    },
    "dmnDrd": {
      "producesStates": ["DecisionRequirementsDeployed"],
      "producesSemantics": ["DecisionRequirementsKey"],
      "identifierType": "DecisionRequirementsId",
      "deploymentSlices": ["decisionRequirements"]
    },
    "form": {
  "producesStates": ["FormDeployed"],
  "producesSemantics": ["FormKey"],
  "identifierType": "FormId",
  "deploymentSlices": ["form"]
    }
  },
  "artifactFileKinds": {
    ".bpmn": ["bpmnProcess"],
    ".bpmn20.xml": ["bpmnProcess"],
    ".dmn": ["dmnDecision", "dmnDrd"],
    ".dmn11.xml": ["dmnDecision", "dmnDrd"],
    ".form": ["form"],
    ".json": ["form"]
  },
  "semanticTypeToArtifactKind": {
    "ProcessDefinitionKey": "bpmnProcess",
    "DecisionDefinitionKey": "dmnDecision",
    "DecisionRequirementsKey": "dmnDrd",
    "FormKey": "form"
  },
  "semanticTypes": {
    "ProcessDefinitionKey": { "witnesses": "ProcessDefinitionDeployed" },
    "ProcessInstanceKey": { "witnesses": "ProcessInstanceExists" },
    "DecisionDefinitionKey": { "witnesses": "DecisionDefinitionDeployed" },
    "DecisionRequirementsKey": { "witnesses": "DecisionRequirementsDeployed" },
    "FormKey": { "witnesses": "FormDeployed" },
    "JobKey": { "witnesses": "JobAvailableForActivation" }
  },
  "operationArtifactRules": {
    "createDeployment": {
      "composable": true,
      "rules": [
        { "id": "bpmn", "artifactKind": "bpmnProcess" },
        { "id": "form", "artifactKind": "form" },
        { "id": "dmn", "artifactKind": "dmnDecision" },
        { "id": "drd", "artifactKind": "dmnDrd" }
      ]
    }
  },
  "globalContextSeeds": [
    {
      "binding": "tenantIdVar",
      "fieldName": "tenantId",
      "seedRule": "tenantIdVar",
      "defaultSentinel": "<default>",
      "stripFromMultipartWhenDefault": true,
      "rationale": "Camunda single-tenant mode default — every emitted scenario seeds tenantIdVar via the seed rule (which yields '<default>'), and multipart bodies must drop the tenantId field when the default sentinel is present so the broker assigns the default tenant."
    }
  ],
  "version": 1
}
